,Qid,sentence_EN,sentence_CN,CN_0_porb,CN_1_porb,CN_2_porb,EN_0_porb,EN_1_porb,EN_2_porb,Wikidata_CN,Wikidata_EN,new_label
39,Q542043,"peter derek vaughan prince 14 august 1915 – 24 september 2003 was a bible teacher whose daily radio programme, derek prince legacy radio, is broadcast around the world in various languages derek prince worked at the faith tabernacle in chicago, and then moved to good news church in ft",叶光明（，）出生在印度，父母均為英國人在英國伊頓公學和劍橋大學受過有關希臘語和拉丁語的優良教育，他曾在國王學院創辦了古代和現代哲學聯誼會,0.00730989733710885,0.9869759678840636,0.0057141073048114785,0.0021332595497369766,0.000785216165240854,0.9970815777778624,出生地班加羅爾,place of birth Bengaluru,B
40,Q684967,"matsuda's best known film roles include the young and desirable samurai sōzaburō kanō in taboo and the rock star ren honjo in nana matsuda was born on 9 may 1983 in tokyo, to yūsaku matsuda, a japanese actor of partial korean ancestry, and miyuki matsuda née kumagai, a japanese actress",松田龍平（），日本男演員，出生於日本東京都，身高183公分體重63公斤,0.005585624370723964,0.9869731068611144,0.007441275753080845,0.895828902721405,0.009718316607177258,0.09445281326770782,出生地杉並區,place of birth Suginami-ku,B
41,Q2626602,"daniyal gadzhiyev born 20 february 1986 in kizilyurt, dagestan is a kazakhstani born-dagestani wrestler who competes for republic of kazakhstan he won the bronze medal at the 2012 summer olympics in the greco-roman men's 84 kg event",丹亞爾·賈吉耶夫（Daniyal Gadzhiyev、）出生於達吉斯坦，是一名哈薩克摔跤運動員，曾代表國家參加2012年倫敦奧運的 84公斤級摔跤比賽，最終獲得銅獎category:哈薩克斯坦運動員,0.0053676324896514424,0.9868992567062378,0.007733085192739963,0.9453274607658386,0.009942174889147282,0.04473043978214264,出生地克孜勒尤爾特,place of birth Kizilyurt,B
42,Q1377715,"born december 15, 1931 in tokyo city, japan is a japanese poet and translator he is one of the most widely read and highly regarded of living japanese poets, both in japan and abroad, and a frequent subject of speculations regarding the nobel prize in literature.""prosing the question"" by mei jia, china daily, 2011-12-15",谷川俊太郎（），日本當代著名詩人、翻譯家及劇作家，出生於東京都，在國際文壇上被公認為最生動和最具有代表性的一位詩人之一谷川俊太郎出生於昭和6年(1931年)，畢業於東京都立豐多摩高校，父親乃是日本哲學家兼法政大學校長之谷川徹三,0.006939040031284094,0.9868979454040528,0.006162984762340784,0.9387824535369872,0.020900016650557518,0.040317539125680917,出生地杉並區,place of birth Suginami-ku,B
43,Q1156472,"brady 'the arizona cowboy' ellison born october 27, 1988 is an american archer who competes in recurve archery he is currently a resident athlete at the united states olympic training center in chula vista, california",布雷迪·埃利森（；），在美国亚利桑那出生，是一名美国男子射箭运动员曾参加2008年、2012年和2016年三届奥运，共收获两枚团体银牌和一枚个人铜牌,0.003788603935390711,0.9868919253349304,0.00931947585195303,0.9493743181228638,0.011439086869359016,0.039186608046293266,出生地格蘭岱爾,place of birth Glendale,B
44,Q718036,"michael fitzgerald wong wong man-tak ; born 16 april 1965 is a chinese-american actor based in hong kong he is fluent in english, but not in chinese, which is reflected in many of the characters he has portrayed",王敏德（，），出生於美國特洛伊，為中法、荷蘭混血兒香港電影演員，于电影作品中经常飾演警官角色，其形象頗為深入民心,0.006235735025256872,0.9868545532226562,0.0069097322411835185,0.9389978647232056,0.010116611607372759,0.050885412842035294,出生地奥尔巴尼,place of birth Albany,B
45,Q1385100,"sir geoffrey winston russell palmer born 21 april 1942 is a new zealand lawyer, legal academic, and past politician, who was a member of parliament from 1979 to 1990 he served as the 33rd prime minister of new zealand for a little over a year, from august 1989 until september 1990, leading the fourth labour government",杰弗里·帕尔默爵士（英文：Sir Geoffrey Winston Russell Palmer，），工党党魁，曾任新西兰总理（1989年8月8日－1990年9月4日）杰弗里·帕尔默1942年出生于新西兰,0.004837517626583576,0.9868502616882324,0.008312247693538666,0.9207947850227356,0.016456319019198418,0.06274892389774323,出生地尼爾遜,place of birth Nelson,B
46,Q523140,"margaret tudor 28 november 1489 – 18 october 1541 was queen of scots from 1503 until 1513 by marriage to james iv of scotland and then, after her husband died fighting the english, she became regent for their son james v of scotland from 1513 until 1515 she was born at westminster palace as the eldest daughter of king henry vii of england and elizabeth of york, and granddaughter of margaret beaufort, edward iv of england and queen elizabeth woodville",玛格丽特·都铎（Margaret Tudor；），也被称为苏格兰王后玛格丽特她出生于英格兰威斯敏斯特宫，是英格兰国王亨利七世和约克的伊丽莎白两个年长存活的女儿,0.0043836086988449105,0.9868347048759459,0.008781702257692814,0.945473611354828,0.007674735970795155,0.046851664781570435,出生地倫敦,place of birth London,B
47,Q187033,"sally margaret field born november 6, 1946 is an american actress and director she is the recipient of various accolades, including two academy awards, three primetime emmy awards, two golden globe awards, and a screen actors guild award, and she has been nominated for a tony award and two bafta awards",莎莉·菲爾德（，），美國電影演員，出生於加利福尼亞州，曾經奪得2次奧斯卡最佳女主角獎曾在美國電視劇《-{zh-hk:兄弟．姊妹; zh-tw:家族風雲; zh-cn:兄弟姐妹;}-》上飾演Nora Walker的角色,0.0050759189762175074,0.9868261218070984,0.008097932673990726,0.9116560816764832,0.016398966312408447,0.07194495946168901,出生地帕萨迪纳,place of birth Pasadena,B
48,Q2823971,"adam thomas kennedy born january 10, 1976 is an american former professional baseball second baseman louis cardinals, oakland athletics, los angeles angels of anaheim, washington nationals, seattle mariners, and los angeles dodgers",亞當·湯瑪斯·甘迺迪（Adam Thomas Kennedy，），是一名美國職棒大聯盟的球員，目前效力於洛杉磯道奇1976年1月10日亞當·甘迺迪出生於加州河邊郡（Riverside）,0.0039172195829451075,0.9868075251579284,0.009275229647755623,0.9063463807106018,0.00975767523050308,0.0838959738612175,出生地里弗赛德,place of birth Riverside,C
49,Q5547081,"georgette chen, born chang li ying was a singaporean painter known for her post-impressionistic styled oil paintings at the turn of the 20th-century she was a pioneer of the visual arts in singapore, who contributed to the birth of the nanyang art style in singapore",张荔英（）是一位新加坡华人画家1906年出生于法国巴黎，她是中国国民党元老张静江和夫人姚蕙的第四个女儿，当时张静江正在巴黎经商，经营中国古董、丝绸、茶叶的贸易,0.00749811576679349,0.986725091934204,0.005776737350970507,0.9508936405181884,0.009509144350886343,0.03959720581769943,出生地浙江省,place of birth Zhejiang,A
